{
  "$schema": "https://json-schema.org/draft/2020-12/schema",
  "$defs": {
    "ConfidenceBreakdown": {
      "description": "confidence_score = data_support x (effort_certainty + risk_certainty) / 2 (ml-engine/reports/confidence.md).",
      "properties": {
        "effort_certainty": {
          "description": "E: share of past estimates with a wider interval",
          "maximum": 1,
          "minimum": 0,
          "title": "Effort Certainty",
          "type": "number"
        },
        "risk_certainty": {
          "description": "R: |2p - 1|, how far the probability is from a coin flip",
          "maximum": 1,
          "minimum": 0,
          "title": "Risk Certainty",
          "type": "number"
        },
        "data_support": {
          "description": "S: 1, lowered by each penalty",
          "maximum": 1,
          "minimum": 0,
          "title": "Data Support",
          "type": "number"
        },
        "penalties": {
          "default": [],
          "items": {
            "$ref": "#/$defs/ConfidencePenalty"
          },
          "title": "Penalties",
          "type": "array"
        }
      },
      "required": [
        "effort_certainty",
        "risk_certainty",
        "data_support"
      ],
      "title": "ConfidenceBreakdown",
      "type": "object"
    },
    "ConfidencePenalty": {
      "properties": {
        "reason": {
          "enum": [
            "cold_start",
            "unseen_project",
            "missing_group"
          ],
          "title": "Reason",
          "type": "string"
        },
        "factor": {
          "description": "What data support is multiplied by",
          "exclusiveMinimum": 0,
          "maximum": 1,
          "title": "Factor",
          "type": "number"
        },
        "detail": {
          "title": "Detail",
          "type": "string"
        }
      },
      "required": [
        "reason",
        "factor",
        "detail"
      ],
      "title": "ConfidencePenalty",
      "type": "object"
    },
    "ModelConfiguration": {
      "properties": {
        "encoder": {
          "title": "Encoder",
          "type": "string"
        },
        "learner": {
          "title": "Learner",
          "type": "string"
        },
        "formulation": {
          "enum": [
            "single_task",
            "multi_task",
            "chained"
          ],
          "title": "Formulation",
          "type": "string"
        }
      },
      "required": [
        "encoder",
        "learner",
        "formulation"
      ],
      "title": "ModelConfiguration",
      "type": "object"
    },
    "Prediction": {
      "properties": {
        "story_id": {
          "title": "Story Id",
          "type": "string"
        },
        "project_id": {
          "title": "Project Id",
          "type": "string"
        },
        "predicted_story_points": {
          "minimum": 0,
          "title": "Predicted Story Points",
          "type": "number"
        },
        "effort_category": {
          "enum": [
            "small",
            "medium",
            "large",
            "extra_large"
          ],
          "title": "Effort Category",
          "type": "string"
        },
        "prediction_interval": {
          "$ref": "#/$defs/PredictionInterval"
        },
        "sprint_risk_level": {
          "enum": [
            "low",
            "medium",
            "high"
          ],
          "title": "Sprint Risk Level",
          "type": "string"
        },
        "spillover_probability": {
          "maximum": 1,
          "minimum": 0,
          "title": "Spillover Probability",
          "type": "number"
        },
        "confidence_score": {
          "maximum": 1,
          "minimum": 0,
          "title": "Confidence Score",
          "type": "number"
        },
        "key_risk_reasons": {
          "items": {
            "$ref": "#/$defs/RiskReason"
          },
          "title": "Key Risk Reasons",
          "type": "array"
        },
        "recommendations": {
          "items": {
            "$ref": "#/$defs/Recommendation"
          },
          "title": "Recommendations",
          "type": "array"
        },
        "model_configuration": {
          "$ref": "#/$defs/ModelConfiguration"
        },
        "selection_mode": {
          "enum": [
            "auto",
            "pinned"
          ],
          "title": "Selection Mode",
          "type": "string"
        },
        "feature_groups_used": {
          "items": {
            "type": "string"
          },
          "title": "Feature Groups Used",
          "type": "array"
        },
        "model_version": {
          "title": "Model Version",
          "type": "string"
        },
        "generated_at": {
          "format": "date-time",
          "title": "Generated At",
          "type": "string"
        },
        "prediction_id": {
          "anyOf": [
            {
              "type": "string"
            },
            {
              "type": "null"
            }
          ],
          "default": null,
          "description": "Audit record id (FR21); for feedback (FR19)",
          "title": "Prediction Id"
        },
        "interval_coverage": {
          "default": 0.8,
          "description": "Share of stories whose points fall in the interval",
          "title": "Interval Coverage",
          "type": "number"
        },
        "at_risk": {
          "default": false,
          "description": "The risk passes the threshold chosen for recall >= 0.70",
          "title": "At Risk",
          "type": "boolean"
        },
        "confidence_level": {
          "default": "low",
          "description": "Band shown to users",
          "enum": [
            "high",
            "medium",
            "low"
          ],
          "title": "Confidence Level",
          "type": "string"
        },
        "confidence_breakdown": {
          "anyOf": [
            {
              "$ref": "#/$defs/ConfidenceBreakdown"
            },
            {
              "type": "null"
            }
          ],
          "default": null,
          "description": "How the score came about"
        },
        "risk_if_all_done": {
          "anyOf": [
            {
              "$ref": "#/$defs/RiskEffect"
            },
            {
              "type": "null"
            }
          ],
          "default": null,
          "description": "The risk once every suggested action is done (only when there are two or more)"
        },
        "configuration_id": {
          "default": "",
          "title": "Configuration Id",
          "type": "string"
        },
        "selection_reason": {
          "default": "",
          "title": "Selection Reason",
          "type": "string"
        },
        "degraded_feature_groups": {
          "default": [],
          "description": "Groups served by a proxy or missing (FR17)",
          "items": {
            "type": "string"
          },
          "title": "Degraded Feature Groups",
          "type": "array"
        },
        "feature_sources": {
          "additionalProperties": {
            "type": "string"
          },
          "default": {},
          "description": "component, request, history, text, proxy or missing",
          "title": "Feature Sources",
          "type": "object"
        },
        "explanation_method": {
          "default": "",
          "title": "Explanation Method",
          "type": "string"
        }
      },
      "required": [
        "story_id",
        "project_id",
        "predicted_story_points",
        "effort_category",
        "prediction_interval",
        "sprint_risk_level",
        "spillover_probability",
        "confidence_score",
        "key_risk_reasons",
        "recommendations",
        "model_configuration",
        "selection_mode",
        "feature_groups_used",
        "model_version",
        "generated_at"
      ],
      "title": "Prediction",
      "type": "object"
    },
    "PredictionInterval": {
      "properties": {
        "lower": {
          "minimum": 0,
          "title": "Lower",
          "type": "number"
        },
        "upper": {
          "minimum": 0,
          "title": "Upper",
          "type": "number"
        }
      },
      "required": [
        "lower",
        "upper"
      ],
      "title": "PredictionInterval",
      "type": "object"
    },
    "Recommendation": {
      "properties": {
        "action": {
          "enum": [
            "split_story",
            "refine_requirement",
            "add_acceptance_criteria",
            "create_tests",
            "resolve_dependency",
            "reduce_sprint_scope",
            "plan_buffer"
          ],
          "title": "Action",
          "type": "string"
        },
        "message": {
          "title": "Message",
          "type": "string"
        },
        "triggered_by": {
          "title": "Triggered By",
          "type": "string"
        },
        "expected_effect": {
          "anyOf": [
            {
              "$ref": "#/$defs/RiskEffect"
            },
            {
              "type": "null"
            }
          ],
          "default": null,
          "description": "The risk once this action is done"
        }
      },
      "required": [
        "action",
        "message",
        "triggered_by"
      ],
      "title": "Recommendation",
      "type": "object"
    },
    "RiskEffect": {
      "description": "The risk the models expect once an action is done: the story's features changed as the action would, and\npredicted again by the same configuration (ml-engine erp/serving/whatif.py).",
      "properties": {
        "spillover_probability": {
          "maximum": 1,
          "minimum": 0,
          "title": "Spillover Probability",
          "type": "number"
        },
        "sprint_risk_level": {
          "enum": [
            "low",
            "medium",
            "high"
          ],
          "title": "Sprint Risk Level",
          "type": "string"
        }
      },
      "required": [
        "spillover_probability",
        "sprint_risk_level"
      ],
      "title": "RiskEffect",
      "type": "object"
    },
    "RiskReason": {
      "properties": {
        "factor": {
          "description": "Planning factor shown to users, e.g. 'Requirement ambiguity'",
          "title": "Factor",
          "type": "string"
        },
        "direction": {
          "enum": [
            "increases",
            "decreases"
          ],
          "title": "Direction",
          "type": "string"
        },
        "weight": {
          "maximum": 1,
          "minimum": 0,
          "title": "Weight",
          "type": "number"
        }
      },
      "required": [
        "factor",
        "direction",
        "weight"
      ],
      "title": "RiskReason",
      "type": "object"
    }
  },
  "properties": {
    "predictions": {
      "items": {
        "$ref": "#/$defs/Prediction"
      },
      "title": "Predictions",
      "type": "array"
    },
    "configuration_id": {
      "default": "",
      "title": "Configuration Id",
      "type": "string"
    },
    "selection_mode": {
      "default": "auto",
      "enum": [
        "auto",
        "pinned"
      ],
      "title": "Selection Mode",
      "type": "string"
    },
    "selection_reason": {
      "default": "",
      "title": "Selection Reason",
      "type": "string"
    }
  },
  "required": [
    "predictions"
  ],
  "title": "EstimateResponse",
  "type": "object"
}
