{
  "predictions": [
    {
      "story_id": "SYN-STEADY-B1",
      "project_id": "SYN-STEADY",
      "predicted_story_points": 3.94,
      "effort_category": "medium",
      "prediction_interval": {
        "lower": 1.71,
        "upper": 8.01
      },
      "sprint_risk_level": "high",
      "spillover_probability": 0.6566,
      "confidence_score": 0.3022,
      "key_risk_reasons": [
        {
          "factor": "Story metadata",
          "direction": "increases",
          "weight": 0.288
        },
        {
          "factor": "Story size and content",
          "direction": "increases",
          "weight": 0.275
        },
        {
          "factor": "Sprint load and timing",
          "direction": "increases",
          "weight": 0.179
        }
      ],
      "recommendations": [],
      "model_configuration": {
        "encoder": "fasttext",
        "learner": "lightgbm",
        "formulation": "single_task"
      },
      "selection_mode": "auto",
      "feature_groups_used": [
        "textual",
        "requirement_quality",
        "dependency",
        "traceability",
        "acceptance_criteria",
        "historical_sprint",
        "sprint_context",
        "metadata"
      ],
      "model_version": "arena-v1/fasttext-lightgbm@cc31492",
      "generated_at": "2026-09-26T17:40:06Z",
      "prediction_id": "07cc2645-700a-4b61-8ebc-f99cfc8457d5",
      "interval_coverage": 0.8,
      "at_risk": true,
      "confidence_level": "low",
      "configuration_id": "fasttext-lightgbm",
      "selection_reason": "pooled winner: the project is not in the leaderboard",
      "degraded_feature_groups": [],
      "feature_sources": {
        "textual": "text",
        "requirement_quality": "component",
        "dependency": "request",
        "traceability": "component",
        "acceptance_criteria": "component",
        "historical_sprint": "history",
        "sprint_context": "history",
        "metadata": "request"
      },
      "explanation_method": "TreeSHAP"
    },
    {
      "story_id": "SYN-STEADY-B2",
      "project_id": "SYN-STEADY",
      "predicted_story_points": 2.91,
      "effort_category": "medium",
      "prediction_interval": {
        "lower": 1.03,
        "upper": 6.54
      },
      "sprint_risk_level": "high",
      "spillover_probability": 0.6566,
      "confidence_score": 0.2306,
      "key_risk_reasons": [
        {
          "factor": "Story size and content",
          "direction": "increases",
          "weight": 0.455
        },
        {
          "factor": "Story metadata",
          "direction": "increases",
          "weight": 0.21
        },
        {
          "factor": "Sprint load and timing",
          "direction": "increases",
          "weight": 0.124
        }
      ],
      "recommendations": [],
      "model_configuration": {
        "encoder": "fasttext",
        "learner": "lightgbm",
        "formulation": "single_task"
      },
      "selection_mode": "auto",
      "feature_groups_used": [
        "textual",
        "requirement_quality",
        "dependency",
        "traceability",
        "acceptance_criteria",
        "historical_sprint",
        "sprint_context",
        "metadata"
      ],
      "model_version": "arena-v1/fasttext-lightgbm@cc31492",
      "generated_at": "2026-09-26T17:40:06Z",
      "prediction_id": "a91dfcaf-77e5-4dbf-aa70-466f33f6fb4a",
      "interval_coverage": 0.8,
      "at_risk": true,
      "confidence_level": "low",
      "configuration_id": "fasttext-lightgbm",
      "selection_reason": "pooled winner: the project is not in the leaderboard",
      "degraded_feature_groups": [],
      "feature_sources": {
        "textual": "text",
        "requirement_quality": "component",
        "dependency": "request",
        "traceability": "component",
        "acceptance_criteria": "component",
        "historical_sprint": "history",
        "sprint_context": "history",
        "metadata": "request"
      },
      "explanation_method": "TreeSHAP"
    },
    {
      "story_id": "SYN-STEADY-B3",
      "project_id": "SYN-STEADY",
      "predicted_story_points": 3.71,
      "effort_category": "medium",
      "prediction_interval": {
        "lower": 1.51,
        "upper": 7.82
      },
      "sprint_risk_level": "high",
      "spillover_probability": 0.6566,
      "confidence_score": 0.2659,
      "key_risk_reasons": [
        {
          "factor": "Story metadata",
          "direction": "increases",
          "weight": 0.335
        },
        {
          "factor": "Story size and content",
          "direction": "increases",
          "weight": 0.205
        },
        {
          "factor": "Sprint load and timing",
          "direction": "increases",
          "weight": 0.2
        }
      ],
      "recommendations": [],
      "model_configuration": {
        "encoder": "fasttext",
        "learner": "lightgbm",
        "formulation": "single_task"
      },
      "selection_mode": "auto",
      "feature_groups_used": [
        "textual",
        "requirement_quality",
        "dependency",
        "traceability",
        "acceptance_criteria",
        "historical_sprint",
        "sprint_context",
        "metadata"
      ],
      "model_version": "arena-v1/fasttext-lightgbm@cc31492",
      "generated_at": "2026-09-26T17:40:06Z",
      "prediction_id": "ff7b8cd4-72ae-4bba-9dcb-eb6ddfa71e22",
      "interval_coverage": 0.8,
      "at_risk": true,
      "confidence_level": "low",
      "configuration_id": "fasttext-lightgbm",
      "selection_reason": "pooled winner: the project is not in the leaderboard",
      "degraded_feature_groups": [],
      "feature_sources": {
        "textual": "text",
        "requirement_quality": "component",
        "dependency": "request",
        "traceability": "component",
        "acceptance_criteria": "component",
        "historical_sprint": "history",
        "sprint_context": "history",
        "metadata": "request"
      },
      "explanation_method": "TreeSHAP"
    }
  ],
  "configuration_id": "fasttext-lightgbm",
  "selection_mode": "auto",
  "selection_reason": "pooled winner: the project is not in the leaderboard"
}
